{
  "contractId": "I-003",
  "contractVersion": "1.0.0",
  "recordId": "trust-bootstrap-001",
  "environmentId": "env-local-example",
  "environmentClass": "local-scratch",
  "informationProfile": "synthetic-only",
  "trustProfile": "local-synthetic",
  "trustDomain": "trust-env-local-example",
  "trustEpoch": 1,
  "signerId": "signer-env-local-example",
  "publicKeyFingerprint": "sha256:aaaaaaaaaaaaaaaaaaaaaaaaaaaaaaaaaaaaaaaaaaaaaaaaaaaaaaaaaaaaaaaa",
  "keyCustodyClass": "local-file",
  "recoveryProfile": "rebuild-new-trust-domain",
  "status": "ready",
  "compatible": true,
  "createdAt": "2030-08-26T10:00:00Z"
}
